{
  "$schema": "https://json-schema.org/draft/2020-12/schema",
  "title": "Clasp Builder Report",
  "type": "object",
  "additionalProperties": false,
  "required": [
    "summary",
    "files_touched",
    "tests_run",
    "residual_risks",
    "feedback"
  ],
  "properties": {
    "summary": { "type": "string" },
    "files_touched": {
      "type": "array",
      "items": { "type": "string" }
    },
    "tests_run": {
      "type": "array",
      "items": { "type": "string" }
    },
    "residual_risks": {
      "type": "array",
      "items": { "type": "string" }
    },
    "feedback": {
      "type": "object",
      "additionalProperties": false,
      "required": ["summary", "ergonomics", "follow_ups", "warnings"],
      "properties": {
        "summary": { "type": "string" },
        "ergonomics": {
          "type": "array",
          "items": { "type": "string" }
        },
        "follow_ups": {
          "type": "array",
          "items": { "type": "string" }
        },
        "warnings": {
          "type": "array",
          "items": { "type": "string" }
        }
      }
    }
  }
}
